{
  "artifact_family": "devmasterd_state",
  "schema_version": "1.0.0",
  "policy_version": "devmasterd-local-kernel-v1",
  "updated_at": "2026-04-30T10:33:25.048209Z",
  "items": [
    {
      "item_id": "item_e48e3bd2135c443d99feb962967aa1b8",
      "status": "provider_completed",
      "created_at": "2026-04-30T10:33:24.994433Z",
      "proposal": {
        "schema_version": "1.0.0",
        "proposal_id": "prop_devmasterd_smoke",
        "trace_id": "tr_devmasterd_smoke",
        "proposer": "human",
        "goal": "Run the devmasterd smoke path.",
        "slices": [
          {
            "slice_id": "slice_devmasterd_smoke",
            "expected_cost_usd": 0.0,
            "provider_kind": "api",
            "risk_label_estimate": "green"
          }
        ]
      }
    }
  ],
  "decisions": [
    {
      "decision_id": "dec_73cec50da11c49498654f4c3d21343c7",
      "item_id": "item_e48e3bd2135c443d99feb962967aa1b8",
      "decided_by": "dev_master",
      "decision": "authorize",
      "decided_at": "2026-04-30T10:33:24.995123Z",
      "provider_self_approval": false,
      "checks": {
        "token_auth_passed": true,
        "provider_mode_stub": true,
        "external_side_effects": false
      }
    }
  ],
  "provider_runs": [
    {
      "run_id": "run_f34ae79092b94cd4b48473f01acf76ac",
      "item_id": "item_e48e3bd2135c443d99feb962967aa1b8",
      "status": "provider_completed",
      "provider_output_ref": "runtime/devmasterd/provider-evidence/item_e48e3bd2135c443d99feb962967aa1b8-run_f34ae79092b94cd4b48473f01acf76ac.json",
      "drift_detected": false,
      "evidence_ref": "runtime/devmasterd/evidence-index.jsonl#ev_ff507d9b4fac4c50",
      "created_at": "2026-04-30T10:33:25.048204Z"
    }
  ],
  "external_side_effects": false,
  "provider_mode": "stub"
}
