{
  "artifact_family": "devmasterd_state",
  "schema_version": "1.0.0",
  "policy_version": "devmasterd-local-kernel-v1",
  "updated_at": "2026-04-30T10:37:49.262033Z",
  "items": [
    {
      "item_id": "item_6af9b7b9ff974d7cb9765974c482f2a1",
      "status": "provider_completed",
      "created_at": "2026-04-30T10:37:12.218235Z",
      "proposal": {
        "schema_version": "1.0.0",
        "proposal_id": "prop_devmasterd_smoke",
        "trace_id": "tr_devmasterd_smoke",
        "proposer": "human",
        "goal": "Run the devmasterd smoke path.",
        "slices": [
          {
            "slice_id": "slice_devmasterd_smoke",
            "expected_cost_usd": 0.0,
            "provider_kind": "api",
            "risk_label_estimate": "green"
          }
        ]
      }
    },
    {
      "item_id": "item_504952683a0f49519ef1ab131f3017a8",
      "status": "provider_completed",
      "created_at": "2026-04-30T10:37:49.259719Z",
      "proposal": {
        "schema_version": "1.0.0",
        "proposal_id": "prop_devmasterd_smoke",
        "trace_id": "tr_devmasterd_smoke",
        "proposer": "human",
        "goal": "Run the devmasterd smoke path.",
        "slices": [
          {
            "slice_id": "slice_devmasterd_smoke",
            "expected_cost_usd": 0.0,
            "provider_kind": "api",
            "risk_label_estimate": "green"
          }
        ]
      }
    }
  ],
  "decisions": [
    {
      "decision_id": "dec_dffafa76c7af4a638cf071ce5d5841aa",
      "item_id": "item_6af9b7b9ff974d7cb9765974c482f2a1",
      "decided_by": "dev_master",
      "decision": "authorize",
      "decided_at": "2026-04-30T10:37:12.218955Z",
      "provider_self_approval": false,
      "checks": {
        "token_auth_passed": true,
        "provider_mode_stub": true,
        "external_side_effects": false
      }
    },
    {
      "decision_id": "dec_4ad94e6b12a8497eb2e94132e78f0278",
      "item_id": "item_504952683a0f49519ef1ab131f3017a8",
      "decided_by": "dev_master",
      "decision": "authorize",
      "decided_at": "2026-04-30T10:37:49.260499Z",
      "provider_self_approval": false,
      "checks": {
        "token_auth_passed": true,
        "provider_mode_stub": true,
        "external_side_effects": false
      }
    }
  ],
  "provider_runs": [
    {
      "run_id": "run_f1cad2eb9eac4d1394e3e89c50202f0c",
      "item_id": "item_6af9b7b9ff974d7cb9765974c482f2a1",
      "status": "provider_completed",
      "provider_output_ref": "runtime/devmasterd/validation-runs/iteration-3/state/provider-evidence/item_6af9b7b9ff974d7cb9765974c482f2a1-run_f1cad2eb9eac4d1394e3e89c50202f0c.json",
      "drift_detected": false,
      "evidence_ref": "runtime/devmasterd/validation-runs/iteration-3/state/evidence-index.jsonl#ev_44dfa3f855f43225",
      "created_at": "2026-04-30T10:37:12.220481Z"
    },
    {
      "run_id": "run_0c3023069f5a4abfb354852cc08424ab",
      "item_id": "item_504952683a0f49519ef1ab131f3017a8",
      "status": "provider_completed",
      "provider_output_ref": "runtime/devmasterd/validation-runs/iteration-3/state/provider-evidence/item_504952683a0f49519ef1ab131f3017a8-run_0c3023069f5a4abfb354852cc08424ab.json",
      "drift_detected": false,
      "evidence_ref": "runtime/devmasterd/validation-runs/iteration-3/state/evidence-index.jsonl#ev_2164797be0d62f1d",
      "created_at": "2026-04-30T10:37:49.262026Z"
    }
  ],
  "external_side_effects": false,
  "provider_mode": "stub"
}
