{
  "artifact_family": "devmasterd_state",
  "schema_version": "1.0.0",
  "policy_version": "devmasterd-local-kernel-v1",
  "updated_at": "2026-04-30T10:42:54.706083Z",
  "items": [
    {
      "item_id": "item_a5301b3180b24db494b01d392256ce9c",
      "status": "provider_completed",
      "created_at": "2026-04-30T10:42:54.656736Z",
      "proposal": {
        "schema_version": "1.0.0",
        "proposal_id": "prop_devmasterd_smoke",
        "trace_id": "tr_devmasterd_smoke",
        "proposer": "human",
        "goal": "Run the devmasterd smoke path.",
        "slices": [
          {
            "slice_id": "slice_devmasterd_smoke",
            "expected_cost_usd": 0.0,
            "provider_kind": "api",
            "risk_label_estimate": "green"
          }
        ]
      }
    }
  ],
  "decisions": [
    {
      "decision_id": "dec_e39f43ff53544d54b090e0d041bcc41e",
      "item_id": "item_a5301b3180b24db494b01d392256ce9c",
      "decided_by": "dev_master",
      "decision": "authorize",
      "decided_at": "2026-04-30T10:42:54.657444Z",
      "provider_self_approval": false,
      "checks": {
        "token_auth_passed": true,
        "provider_mode_stub": true,
        "external_side_effects": false
      }
    }
  ],
  "provider_runs": [
    {
      "run_id": "run_2519bf9afcea4056bca2dd7f0cc28c20",
      "item_id": "item_a5301b3180b24db494b01d392256ce9c",
      "status": "provider_completed",
      "provider_output_ref": "runtime/devmasterd/loopback-hardening-validation/iteration-1/state/provider-evidence/item_a5301b3180b24db494b01d392256ce9c-run_2519bf9afcea4056bca2dd7f0cc28c20.json",
      "drift_detected": false,
      "evidence_ref": "runtime/devmasterd/loopback-hardening-validation/iteration-1/state/evidence-index.jsonl#ev_522238303bb2d538",
      "created_at": "2026-04-30T10:42:54.706077Z"
    }
  ],
  "external_side_effects": false,
  "provider_mode": "stub"
}
